{
  "slug": "bench-sqlite-everywhere",
  "title": "SQLite is already on your phone",
  "topic": "the database in your pocket",
  "seed": 11,
  "brand": {
    "slug": "sqlite"
  },
  "hook": {
    "alternates": [
      "The most used database in the world is free, tiny, and already in your pocket."
    ],
    "selected": 0,
    "headline": "ALREADY IN YOUR POCKET"
  },
  "facts": [
    {
      "id": "f1",
      "claim": "SQLite ships on every Android and every iPhone",
      "value": "every phone",
      "source_url": "https://www.sqlite.org/mostdeployed.html",
      "accessed": "2026-10-09"
    },
    {
      "id": "f2",
      "claim": "SQLite is in every Firefox, Chrome and Safari browser",
      "value": "every browser",
      "source_url": "https://www.sqlite.org/mostdeployed.html",
      "accessed": "2026-10-09"
    },
    {
      "id": "f3",
      "claim": "SQLite estimates over one trillion databases in active use",
      "value": "1 trillion",
      "source_url": "https://www.sqlite.org/mostdeployed.html",
      "accessed": "2026-10-09"
    },
    {
      "id": "f4",
      "claim": "All SQLite code is dedicated to the public domain",
      "value": "public domain",
      "source_url": "https://www.sqlite.org/copyright.html",
      "accessed": "2026-10-09"
    },
    {
      "id": "f5",
      "claim": "A SQLite database is a single disk file",
      "value": "one file",
      "source_url": "https://www.sqlite.org/onefile.html",
      "accessed": "2026-10-09"
    }
  ],
  "beats": [
    {
      "id": "phones",
      "narration": "It is called SQLite, and it ships inside every Android phone and every iPhone.",
      "fact": "f1",
      "headline": "INSIDE EVERY PHONE",
      "payoff_headline": "ANDROID AND IPHONE",
      "visual": {
        "rig": "device-wall",
        "params": {
          "kind": "phone",
          "count": 6,
          "label": "EVERY PHONE",
          "names": [
            "ANDROID",
            "IPHONE"
          ]
        },
        "room": "street"
      },
      "relation": "everywhere"
    },
    {
      "id": "browsers",
      "narration": "Your browser runs it too, in Chrome, Firefox and Safari.",
      "fact": "f2",
      "headline": "IN YOUR BROWSER TOO",
      "payoff_headline": "CHROME, FIREFOX, SAFARI",
      "visual": {
        "rig": "device-wall",
        "params": {
          "kind": "browser",
          "count": 3,
          "label": "EVERY BROWSER",
          "names": [
            "CHROME",
            "FIREFOX",
            "SAFARI"
          ]
        },
        "room": "arcade"
      },
      "relation": "everywhere"
    },
    {
      "id": "trillion",
      "narration": "The team estimates over a trillion SQLite databases are in use right now.",
      "fact": "f3",
      "headline": "A TRILLION DATABASES",
      "payoff_headline": "OVER ONE TRILLION",
      "visual": {
        "rig": "stacked-meter",
        "params": {
          "from": 2,
          "to": 13,
          "unit": "",
          "label": "DATABASES",
          "rocket": true
        },
        "room": "rooftop",
        "insert": {
          "kind": "progress_bar",
          "args": {
            "fraction": 1.0,
            "label": "1,000,000,000,000"
          }
        }
      },
      "relation": "big-number"
    },
    {
      "id": "free",
      "narration": "And it costs nothing, because the code is in the public domain.",
      "fact": "f4",
      "headline": "IT COSTS NOTHING",
      "payoff_headline": "PUBLIC DOMAIN",
      "visual": {
        "rig": "hydraulic-press",
        "params": {
          "object": "LICENSE FEE",
          "force": "PUBLIC DOMAIN"
        },
        "room": "diner",
        "insert": {
          "kind": "price_tag",
          "args": {
            "amount": "$0",
            "strike": "$$$"
          }
        }
      },
      "relation": "cost-crush"
    },
    {
      "id": "onefile",
      "narration": "Your whole database is just one file you can copy anywhere.",
      "fact": "f5",
      "headline": "THE WHOLE DATABASE",
      "payoff_headline": "COPY IT ANYWHERE",
      "visual": {
        "rig": "app-screen",
        "params": {
          "device": "laptop",
          "ui": "window",
          "title": "My files",
          "lines": [
            "app.db  (whole database)"
          ],
          "result": "ONE FILE",
          "button": "COPY",
          "send_to": "USB"
        },
        "room": "stage"
      },
      "relation": "demo"
    }
  ],
  "cta": {
    "keyword": "SQLite",
    "narration": "For the links, comment SQLite.",
    "room": "park"
  },
  "look": "primary-pop"
}
